{
  "contract_version": "investment-agent.v1",
  "request_id": "req-demo-20261007-001",
  "operation": "PORTFOLIO_HEALTH_CHECK",
  "context": {
    "actor": "agent",
    "environment": "demo",
    "data_mode": "SYNTHETIC_REPLAY",
    "task_id": null,
    "session_id": null
  },
  "input": {
    "risk_profile": {
      "investment_horizon_days": 365,
      "max_drawdown": 0.1,
      "liquidity_need": "medium"
    },
    "portfolio": {
      "portfolio_id": "golden-demo-portfolio",
      "as_of": "2026-09-23T08:00:00Z",
      "cash": 10000,
      "positions": [
        {
          "instrument_id": "EQUITY_ALPHA",
          "name": "Alpha Holdings",
          "type": "A_SHARE",
          "sector": "Technology",
          "quantity": 100,
          "price": 47.2
        },
        {
          "instrument_id": "ETF_GROWTH",
          "name": "Growth ETF",
          "type": "ETF",
          "sector": "Technology",
          "quantity": 100,
          "price": 75.5
        },
        {
          "instrument_id": "ETF_CONSUMER",
          "name": "Consumer ETF",
          "type": "ETF",
          "sector": "Consumer",
          "quantity": 100,
          "price": 47.6
        },
        {
          "instrument_id": "ETF_BOND",
          "name": "Bond ETF",
          "type": "ETF",
          "sector": "Fixed Income",
          "quantity": 100,
          "price": 40.5
        }
      ]
    }
  }
}
